{
  "$schema": "https://json-schema.org/draft/2020-12/schema",
  "title": "Kits (one per club per season or period)",
  "description": "hotspot: logo centre (x,y) and size (w,h) as fractions of the photo (photos are 720x800). cardSlot: where the sponsor card sits around the shirts on the team page.",
  "type": "array",
  "items": {
    "type": "object",
    "required": [
      "id",
      "clubId",
      "season",
      "kitType",
      "periodLabel",
      "periodFrom",
      "periodTo",
      "photos",
      "sponsors",
      "sponsorsComplete",
      "summary",
      "change"
    ],
    "additionalProperties": false,
    "properties": {
      "id": {
        "type": "string"
      },
      "clubId": {
        "type": "string",
        "pattern": "^[a-z0-9]+(-[a-z0-9]+)*$"
      },
      "season": {
        "type": [
          "string",
          "null"
        ],
        "pattern": "^[0-9]{4}(-[0-9]{2})?$"
      },
      "kitType": {
        "enum": [
          "home",
          "away",
          "third"
        ]
      },
      "periodLabel": {
        "type": "string"
      },
      "periodFrom": {
        "type": [
          "string",
          "null"
        ],
        "pattern": "^[0-9]{4}(-[0-9]{2})?$"
      },
      "periodTo": {
        "type": [
          "string",
          "null"
        ],
        "pattern": "^[0-9]{4}(-[0-9]{2})?$"
      },
      "photos": {
        "type": "object",
        "required": [],
        "additionalProperties": false,
        "properties": {
          "front": {
            "type": "string"
          },
          "back": {
            "type": "string"
          },
          "square": {
            "type": "string"
          }
        }
      },
      "sponsors": {
        "type": "array",
        "items": {
          "type": "object",
          "required": [
            "sponsorId",
            "placement"
          ],
          "additionalProperties": false,
          "properties": {
            "sponsorId": {
              "type": "string",
              "pattern": "^[a-z0-9]+(-[a-z0-9]+)*$"
            },
            "placement": {
              "enum": [
                "front",
                "back",
                "sleeve",
                "shorts",
                "stadium",
                "partner",
                "league-partner",
                "training-kit"
              ]
            },
            "side": {
              "enum": [
                "front",
                "back"
              ]
            },
            "hotspot": {
              "type": "object",
              "required": [
                "x",
                "y",
                "w",
                "h"
              ],
              "additionalProperties": false,
              "properties": {
                "x": {
                  "type": "number"
                },
                "y": {
                  "type": "number"
                },
                "w": {
                  "type": "number"
                },
                "h": {
                  "type": "number"
                }
              }
            },
            "cardSlot": {
              "enum": [
                "L",
                "R",
                "T"
              ]
            }
          }
        }
      },
      "sponsorsComplete": {
        "type": "boolean"
      },
      "summary": {
        "type": [
          "string",
          "null"
        ]
      },
      "change": {
        "type": [
          "object",
          "null"
        ]
      },
      "levelOverride": {
        "enum": [
          "not-rated",
          "clean",
          "spotted",
          "stained",
          "soaked"
        ]
      }
    }
  }
}